{
  "schema_version": "1.0.0",
  "artifact": "diagram-specs",
  "run_id": "RUN-20260601-163451",
  "generated_at": "2026-06-01T16:42:43+08:00",
  "producer": {
    "agent": "Mermaid Agent",
    "version": "1.0.0"
  },
  "inputs": [
    {
      "artifact": "requirements",
      "path": "output/records/requirements.json",
      "schema_version": "1.0.0"
    },
    {
      "artifact": "design-blueprint",
      "path": "output/records/design-blueprint.json",
      "schema_version": "1.0.0"
    },
    {
      "artifact": "diagram-plan",
      "path": "output/records/diagram-plan.json",
      "schema_version": "1.0.0"
    }
  ],
  "diagrams": [
    {
      "diagram_id": "DG001",
      "title": "系统总体架构图",
      "kind": "architecture",
      "mermaid_path": "output/records/diagrams/DG001.mmd",
      "mermaid": "flowchart TB\nsubgraph L1[数据接入与解析层]\nM1[数据导入模块]\nM2[元数据提取模块]\nend\nsubgraph L2[资产映射与空间分析层]\nM3[空间坐标匹配模块]\nM4[部件级数据挂载模块]\nend\nsubgraph L3[人工智能分析层]\nM5[可见光缺陷识别模块]\nM6[红外热点分析模块]\nM7[模型训练管理模块]\nend\nsubgraph L4[点云数据处理层]\nM8[点云渲染与可视化模块]\nM9[空间距离测算模块]\nend\nsubgraph L5[缺陷管理与业务协同层]\nM10[人机协同复核模块]\nM11[工单流转管控模块]\nend\nL1 --> L2\nL2 --> L3\nL3 --> L4\nL4 --> L5",
      "source_requirement_ids": [
        "T001",
        "Q001",
        "Q002",
        "Q003",
        "Q004",
        "Q005",
        "T002",
        "T003",
        "T004",
        "Q006",
        "T005"
      ],
      "related_section_ids": [
        "SEC001",
        "SEC002",
        "SEC003",
        "SEC004"
      ],
      "related_module_ids": [
        "M001",
        "M002",
        "M003",
        "M004",
        "M005",
        "M006",
        "M007",
        "M008",
        "M009",
        "M010",
        "M011"
      ],
      "description": "系统总体架构图，展示五层分层架构及核心模块，数据自下而上逐层流转。",
      "node_trace": [
        {
          "node_id": "A",
          "label": "系统总体架构图",
          "source_requirement_ids": [
            "T001"
          ]
        }
      ],
      "status": "generated",
      "review_notes": []
    },
    {
      "diagram_id": "DG002",
      "title": "多源异构数据接入与解析流程图",
      "kind": "function_flow",
      "mermaid_path": "output/records/diagrams/DG002.mmd",
      "mermaid": "flowchart TB\nA[可见光/红外/视频/LiDAR数据] --> B[数据导入模块：批量导入/存储挂载/API]\nB --> C[元数据提取模块：EXIF及遥测数据提取]\nC --> D[数据格式清洗]\nD --> E[标准化入库]\nE --> F[数据准备完成]",
      "source_requirement_ids": [
        "T001",
        "Q001"
      ],
      "related_section_ids": [
        "SEC003",
        "SEC007",
        "SEC008"
      ],
      "related_module_ids": [
        "M001",
        "M002"
      ],
      "description": "多源异构数据接入与解析流程图，从数据导入到元数据提取与标准化入库。",
      "node_trace": [
        {
          "node_id": "A",
          "label": "多源异构数据接入与解析流程图",
          "source_requirement_ids": [
            "T001"
          ]
        }
      ],
      "status": "generated",
      "review_notes": []
    },
    {
      "diagram_id": "DG003",
      "title": "输电资产台账与空间位置映射流程图",
      "kind": "function_flow",
      "mermaid_path": "output/records/diagrams/DG003.mmd",
      "mermaid": "flowchart TB\nA[影像元数据：GPS坐标/位姿] --> B[空间坐标匹配模块：GIS空间运算]\nB --> C[判定所属线路段及杆塔]\nC --> D[部件级数据挂载模块：空间解算/图像特征匹配]\nD --> E[影像归档至部件逻辑节点]\nE --> F[资产映射完成]",
      "source_requirement_ids": [
        "Q002",
        "Q003"
      ],
      "related_section_ids": [
        "SEC003",
        "SEC007",
        "SEC008"
      ],
      "related_module_ids": [
        "M003",
        "M004"
      ],
      "description": "输电资产台账与空间位置映射流程图，利用GPS和位姿信息匹配杆塔并挂载至部件。",
      "node_trace": [
        {
          "node_id": "A",
          "label": "输电资产台账与空间位置映射流程图",
          "source_requirement_ids": [
            "Q002"
          ]
        }
      ],
      "status": "generated",
      "review_notes": []
    },
    {
      "diagram_id": "DG004",
      "title": "人工智能视觉分析中台流程图",
      "kind": "function_flow",
      "mermaid_path": "output/records/diagrams/DG004.mmd",
      "mermaid": "flowchart TB\nA[可见光影像] --> B[可见光缺陷识别模块：深度学习模型识别]\nC[红外图像] --> D[红外热点分析模块：温度矩阵解析]\nB --> E[缺陷框选标注]\nD --> F[异常发热缺陷识别]\nE --> G[缺陷记录]\nF --> G\nG --> H[模型训练管理模块：人工复核样本回流]\nH --> B\nH --> D",
      "source_requirement_ids": [
        "Q004",
        "Q005",
        "T002"
      ],
      "related_section_ids": [
        "SEC003",
        "SEC007",
        "SEC008"
      ],
      "related_module_ids": [
        "M005",
        "M006",
        "M007"
      ],
      "description": "人工智能视觉分析中台流程图，包括可见光缺陷识别、红外热点分析及模型训练管理。",
      "node_trace": [
        {
          "node_id": "A",
          "label": "人工智能视觉分析中台流程图",
          "source_requirement_ids": [
            "Q004"
          ]
        }
      ],
      "status": "generated",
      "review_notes": []
    },
    {
      "diagram_id": "DG005",
      "title": "三维点云数据处理与分析流程图",
      "kind": "function_flow",
      "mermaid_path": "output/records/diagrams/DG005.mmd",
      "mermaid": "flowchart TB\nA[LiDAR点云数据] --> B[点云渲染与可视化模块：轻量化渲染]\nB --> C[三维可视化展示]\nC --> D[空间距离测算模块：导线/地面/植被模型提取]\nD --> E[计算交跨距离与树障安全距离]\nE --> F[三维空间标注危险点]\nF --> G[安全距离分析完成]",
      "source_requirement_ids": [
        "T003",
        "T004"
      ],
      "related_section_ids": [
        "SEC003",
        "SEC007",
        "SEC008"
      ],
      "related_module_ids": [
        "M008",
        "M009"
      ],
      "description": "三维点云数据处理与分析流程图，从点云渲染到空间距离测算并标注危险点。",
      "node_trace": [
        {
          "node_id": "A",
          "label": "三维点云数据处理与分析流程图",
          "source_requirement_ids": [
            "T003"
          ]
        }
      ],
      "status": "generated",
      "review_notes": []
    },
    {
      "diagram_id": "DG006",
      "title": "缺陷管理与业务协同流程图",
      "kind": "function_flow",
      "mermaid_path": "output/records/diagrams/DG006.mmd",
      "mermaid": "flowchart TB\nA[AI初筛缺陷记录] --> B[人机协同复核模块：阅片审核修正评级]\nB --> C[人工审核结果]\nC --> D{缺陷等级判断}\nD -->|紧急| E[自动生成消缺建议]\nD -->|一般| E\nE --> F[工单流转管控模块：触发生产系统工单]\nF --> G[缺陷闭环处理完成]",
      "source_requirement_ids": [
        "Q006",
        "T005"
      ],
      "related_section_ids": [
        "SEC003",
        "SEC007",
        "SEC008"
      ],
      "related_module_ids": [
        "M010",
        "M011"
      ],
      "description": "缺陷管理与业务协同流程图，人机协同复核与工单流转闭环。",
      "node_trace": [
        {
          "node_id": "A",
          "label": "缺陷管理与业务协同流程图",
          "source_requirement_ids": [
            "Q006"
          ]
        }
      ],
      "status": "generated",
      "review_notes": []
    }
  ]
}
