{
  "schema_version": "1.0.0",
  "artifact": "diagram-specs",
  "run_id": "RUN-20260530-210000",
  "generated_at": "2026-05-30T21:00:00+08:00",
  "producer": {
    "agent": "Mermaid Agent",
    "version": "1.0.0"
  },
  "inputs": [
    {
      "artifact": "design-blueprint",
      "path": "output/records/design-blueprint.json",
      "schema_version": "1.0.0"
    }
  ],
  "diagrams": [
    {
      "diagram_id": "DG001",
      "title": "海图综合态势展示流程图",
      "kind": "function_flow",
      "mermaid_path": "working/agent-system/staging/diagrams/DG001.mmd",
      "mermaid": "flowchart TB\nA[读取海图数据] --> B[匹配显示区域]\nB --> C[图层控制]",
      "source_requirement_ids": ["T001"],
      "related_section_ids": ["SEC001"],
      "related_module_ids": ["M001"],
      "description": "展示海图数据读取、匹配和图层控制流程。",
      "node_trace": [
        {
          "node_id": "A",
          "label": "读取海图数据",
          "source_requirement_ids": ["T001"]
        }
      ],
      "status": "generated",
      "review_notes": []
    }
  ]
}
